<?xml version="1.0" encoding="UTF-8"?>
<POLYGONS
	xmlns:xsi="http://www.w3.org/2001/XMLSchema-instance"
 xsi:noNamespaceSchemaLocation="mmp.xsd" creator="Measure Map Online" date="Wednesday, Jan 22, 2025 12:11 am" project="yyyyy">
	<POLYGON>
		<NAME>Hole 1</NAME>
		<DESCRIPTION/>
		<ISHOLE>1</ISHOLE>
		<BLOCKED>1</BLOCKED>
		<SHAPE>0</SHAPE>
		<NOSURFACE>0</NOSURFACE>
		<SHOWPINS>0</SHOWPINS>
		<SHOWDISTANCES>1</SHOWDISTANCES>
		<LINECOLOR>6</LINECOLOR>
		<LINECUSTOMCOLOR>ff0000</LINECUSTOMCOLOR>
		<LINEWIDTH>2</LINEWIDTH>
		<LINESTYLE>2</LINESTYLE>
		<AREACOLOR>6</AREACOLOR>
		<AREACUSTOMCOLOR>00ff00</AREACUSTOMCOLOR>
		<AREATRANSPARENCY>7</AREATRANSPARENCY>
		<SHOWNAME>0</SHOWNAME>
		<SHOWLABELBACKGROUND>1</SHOWLABELBACKGROUND>
		<SHOWAREAMEASURE>0</SHOWAREAMEASURE>
		<SHOWPERIMETERMEASURE>0</SHOWPERIMETERMEASURE>
		<COORDINATEPOLYGONLABELLATITUDE>39.98203201420783</COORDINATEPOLYGONLABELLATITUDE>
		<COORDINATEPOLYGONLABELLONGITUDE>-0.024453356047345637</COORDINATEPOLYGONLABELLONGITUDE>
		<COORDINATEPERIMETERLABELLATITUDE>39.98203201420783</COORDINATEPERIMETERLABELLATITUDE>
		<COORDINATEPERIMETERLABELLONGITUDE>-0.024453356047345637</COORDINATEPERIMETERLABELLONGITUDE>
		<COORDINATEAREALABELLATITUDE>39.98203201420783</COORDINATEAREALABELLATITUDE>
		<COORDINATEAREALABELLONGITUDE>-0.024453356047345637</COORDINATEAREALABELLONGITUDE>
		<POINTS>
			<POINT>
				<LAT>39.98201624867061</LAT>
				<LONG>-0.024657645502342482</LONG>
				<ALT>0</ALT>
				<DESCPOINT>
					<SHOWDESC>0</SHOWDESC>
					<SHOWLABELBACKGROUND>0</SHOWLABELBACKGROUND>
					<SHOWDESCINREPORT>0</SHOWDESCINREPORT>
					<DESC/>
					<DESCLAT>39.98201624867061</DESCLAT>
					<DESCLONG>-0.024657645502342482</DESCLONG>
				</DESCPOINT>
			</POINT>
			<POINT>
				<LAT>39.98234058154104</LAT>
				<LONG>-0.02450479586627675</LONG>
				<ALT>0</ALT>
				<DESCPOINT>
					<SHOWDESC>0</SHOWDESC>
					<SHOWLABELBACKGROUND>0</SHOWLABELBACKGROUND>
					<SHOWDESCINREPORT>0</SHOWDESCINREPORT>
					<DESC/>
					<DESCLAT>39.98234058154104</DESCLAT>
					<DESCLONG>-0.02450479586627675</DESCLONG>
				</DESCPOINT>
			</POINT>
			<POINT>
				<LAT>39.98202300562112</LAT>
				<LONG>-0.02424906659234879</LONG>
				<ALT>0</ALT>
				<DESCPOINT>
					<SHOWDESC>0</SHOWDESC>
					<SHOWLABELBACKGROUND>0</SHOWLABELBACKGROUND>
					<SHOWDESCINREPORT>0</SHOWDESCINREPORT>
					<DESC/>
					<DESCLAT>39.98202300562112</DESCLAT>
					<DESCLONG>-0.02424906659234879</DESCLONG>
				</DESCPOINT>
			</POINT>
			<POINT>
				<LAT>39.981723446874625</LAT>
				<LONG>-0.024604735997437496</LONG>
				<ALT>0</ALT>
				<DESCPOINT>
					<SHOWDESC>0</SHOWDESC>
					<SHOWLABELBACKGROUND>0</SHOWLABELBACKGROUND>
					<SHOWDESCINREPORT>0</SHOWDESCINREPORT>
					<DESC/>
					<DESCLAT>39.981723446874625</DESCLAT>
					<DESCLONG>-0.024604735997437496</DESCLONG>
				</DESCPOINT>
			</POINT>
			<POINT>
				<LAT>39.98201624867061</LAT>
				<LONG>-0.024657645502342482</LONG>
				<ALT>0</ALT>
				<DESCPOINT>
					<SHOWDESC>0</SHOWDESC>
					<SHOWLABELBACKGROUND>0</SHOWLABELBACKGROUND>
					<SHOWDESCINREPORT>0</SHOWDESCINREPORT>
					<DESC/>
					<DESCLAT>39.98201624867061</DESCLAT>
					<DESCLONG>-0.024657645502342482</DESCLONG>
				</DESCPOINT>
			</POINT>
		</POINTS>
	</POLYGON>
	<POLYGON>
		<NAME>Polygon 1</NAME>
		<DESCRIPTION/>
		<ISHOLE>0</ISHOLE>
		<BLOCKED>1</BLOCKED>
		<SHAPE>0</SHAPE>
		<NOSURFACE>0</NOSURFACE>
		<SHOWPINS>1</SHOWPINS>
		<SHOWDISTANCES>1</SHOWDISTANCES>
		<LINECOLOR>6</LINECOLOR>
		<LINECUSTOMCOLOR>ff0000</LINECUSTOMCOLOR>
		<LINEWIDTH>2</LINEWIDTH>
		<LINESTYLE>0</LINESTYLE>
		<AREACOLOR>6</AREACOLOR>
		<AREACUSTOMCOLOR>0000ff</AREACUSTOMCOLOR>
		<AREATRANSPARENCY>7</AREATRANSPARENCY>
		<SHOWNAME>1</SHOWNAME>
		<SHOWLABELBACKGROUND>1</SHOWLABELBACKGROUND>
		<SHOWAREAMEASURE>1</SHOWAREAMEASURE>
		<SHOWPERIMETERMEASURE>0</SHOWPERIMETERMEASURE>
		<COORDINATEPOLYGONLABELLATITUDE>39.982331561306935</COORDINATEPOLYGONLABELLATITUDE>
		<COORDINATEPOLYGONLABELLONGITUDE>-0.025147058423044398</COORDINATEPOLYGONLABELLONGITUDE>
		<COORDINATEPERIMETERLABELLATITUDE>39.982331561306935</COORDINATEPERIMETERLABELLATITUDE>
		<COORDINATEPERIMETERLABELLONGITUDE>-0.025147058423044398</COORDINATEPERIMETERLABELLONGITUDE>
		<COORDINATEAREALABELLATITUDE>39.982331561306935</COORDINATEAREALABELLATITUDE>
		<COORDINATEAREALABELLONGITUDE>-0.025147058423044398</COORDINATEAREALABELLONGITUDE>
		<POINTS>
			<POINT>
				<LAT>39.98178899057892</LAT>
				<LONG>-0.026727765250370586</LONG>
				<ALT>0</ALT>
				<DESCPOINT>
					<SHOWDESC>0</SHOWDESC>
					<SHOWLABELBACKGROUND>0</SHOWLABELBACKGROUND>
					<SHOWDESCINREPORT>0</SHOWDESCINREPORT>
					<DESC/>
					<DESCLAT>39.98178899057892</DESCLAT>
					<DESCLONG>-0.026727765250370586</DESCLONG>
				</DESCPOINT>
			</POINT>
			<POINT>
				<LAT>39.98333450470147</LAT>
				<LONG>-0.024338823657103638</LONG>
				<ALT>0</ALT>
				<DESCPOINT>
					<SHOWDESC>0</SHOWDESC>
					<SHOWLABELBACKGROUND>0</SHOWLABELBACKGROUND>
					<SHOWDESCINREPORT>0</SHOWDESCINREPORT>
					<DESC/>
					<DESCLAT>39.98333450470147</DESCLAT>
					<DESCLONG>-0.024338823657103638</DESCLONG>
				</DESCPOINT>
				<PICTURES>
					<PICTURE>
						<PICTUREURL>https://firebasestorage.googleapis.com/v0/b/api-project-196280979389.appspot.com/o/images%2FD1d5RjEy5oWn7njdqm3CHOsWyuX2%2F20240326-06_27--NtvnOpmvi5u9tVnaDV8.png?alt=media&amp;token=30b7a64d-0c33-44a1-a8a1-406f0ef3c007</PICTUREURL>
					</PICTURE>
					<PICTURE>
						<PICTUREURL>https://firebasestorage.googleapis.com/v0/b/api-project-196280979389.appspot.com/o/images%2FD1d5RjEy5oWn7njdqm3CHOsWyuX2%2F20240326-06_28--NtvnaEioFvGY0xtZKbG.png?alt=media&amp;token=9631d046-5489-4a97-a579-78b3aeda03ef</PICTUREURL>
					</PICTURE>
				</PICTURES>
			</POINT>
			<POINT>
				<LAT>39.9813286179124</LAT>
				<LONG>-0.023566351595718214</LONG>
				<ALT>0</ALT>
				<DESCPOINT>
					<SHOWDESC>0</SHOWDESC>
					<SHOWLABELBACKGROUND>0</SHOWLABELBACKGROUND>
					<SHOWDESCINREPORT>0</SHOWDESCINREPORT>
					<DESC/>
					<DESCLAT>39.9813286179124</DESCLAT>
					<DESCLONG>-0.023566351595718214</DESCLONG>
				</DESCPOINT>
			</POINT>
			<POINT>
				<LAT>39.98178899057892</LAT>
				<LONG>-0.026727765250370586</LONG>
				<ALT>0</ALT>
				<DESCPOINT>
					<SHOWDESC>0</SHOWDESC>
					<SHOWLABELBACKGROUND>0</SHOWLABELBACKGROUND>
					<SHOWDESCINREPORT>0</SHOWDESCINREPORT>
					<DESC/>
					<DESCLAT>39.98178899057892</DESCLAT>
					<DESCLONG>-0.026727765250370586</DESCLONG>
				</DESCPOINT>
			</POINT>
		</POINTS>
	</POLYGON>
	<POLYGON>
		<NAME>Polygon 1-buffer</NAME>
		<DESCRIPTION/>
		<ISHOLE>0</ISHOLE>
		<BLOCKED>1</BLOCKED>
		<SHAPE>0</SHAPE>
		<NOSURFACE>0</NOSURFACE>
		<SHOWPINS>0</SHOWPINS>
		<SHOWDISTANCES>0</SHOWDISTANCES>
		<LINECOLOR>6</LINECOLOR>
		<LINECUSTOMCOLOR>ff0000</LINECUSTOMCOLOR>
		<LINEWIDTH>2</LINEWIDTH>
		<LINESTYLE>0</LINESTYLE>
		<AREACOLOR>6</AREACOLOR>
		<AREACUSTOMCOLOR>0000ff</AREACUSTOMCOLOR>
		<AREATRANSPARENCY>7</AREATRANSPARENCY>
		<SHOWNAME>1</SHOWNAME>
		<SHOWLABELBACKGROUND>1</SHOWLABELBACKGROUND>
		<SHOWAREAMEASURE>1</SHOWAREAMEASURE>
		<SHOWPERIMETERMEASURE>0</SHOWPERIMETERMEASURE>
		<COORDINATEPOLYGONLABELLATITUDE>39.98233118614747</COORDINATEPOLYGONLABELLATITUDE>
		<COORDINATEPOLYGONLABELLONGITUDE>-0.02577988835655871</COORDINATEPOLYGONLABELLONGITUDE>
		<COORDINATEPERIMETERLABELLATITUDE>39.98233118614747</COORDINATEPERIMETERLABELLATITUDE>
		<COORDINATEPERIMETERLABELLONGITUDE>-0.02577988835655871</COORDINATEPERIMETERLABELLONGITUDE>
		<COORDINATEAREALABELLATITUDE>39.98233118614747</COORDINATEAREALABELLATITUDE>
		<COORDINATEAREALABELLONGITUDE>-0.02577988835655871</COORDINATEAREALABELLONGITUDE>
		<POINTS>
			<POINT>
				<LAT>39.98161197878896</LAT>
				<LONG>-0.026771667506203314</LONG>
				<ALT>0</ALT>
				<DESCPOINT>
					<SHOWDESC>0</SHOWDESC>
					<SHOWLABELBACKGROUND>1</SHOWLABELBACKGROUND>
					<SHOWDESCINREPORT>1</SHOWDESCINREPORT>
					<DESC/>
					<DESCLAT>39.98161197878896</DESCLAT>
					<DESCLONG>-0.026771667506203314</DESCLONG>
				</DESCPOINT>
			</POINT>
			<POINT>
				<LAT>39.98162251822352</LAT>
				<LONG>-0.02681772695614499</LONG>
				<ALT>0</ALT>
				<DESCPOINT>
					<SHOWDESC>0</SHOWDESC>
					<SHOWLABELBACKGROUND>1</SHOWLABELBACKGROUND>
					<SHOWDESCINREPORT>1</SHOWDESCINREPORT>
					<DESC/>
					<DESCLAT>39.98162251822352</DESCLAT>
					<DESCLONG>-0.02681772695614499</DESCLONG>
				</DESCPOINT>
			</POINT>
			<POINT>
				<LAT>39.981640014412015</LAT>
				<LONG>-0.02686002700147591</LONG>
				<ALT>0</ALT>
				<DESCPOINT>
					<SHOWDESC>0</SHOWDESC>
					<SHOWLABELBACKGROUND>1</SHOWLABELBACKGROUND>
					<SHOWDESCINREPORT>1</SHOWDESCINREPORT>
					<DESC/>
					<DESCLAT>39.981640014412015</DESCLAT>
					<DESCLONG>-0.02686002700147591</DESCLONG>
				</DESCPOINT>
			</POINT>
			<POINT>
				<LAT>39.98166373620196</LAT>
				<LONG>-0.02689679996381825</LONG>
				<ALT>0</ALT>
				<DESCPOINT>
					<SHOWDESC>0</SHOWDESC>
					<SHOWLABELBACKGROUND>1</SHOWLABELBACKGROUND>
					<SHOWDESCINREPORT>1</SHOWDESCINREPORT>
					<DESC/>
					<DESCLAT>39.98166373620196</DESCLAT>
					<DESCLONG>-0.02689679996381825</DESCLONG>
				</DESCPOINT>
			</POINT>
			<POINT>
				<LAT>39.98169269227767</LAT>
				<LONG>-0.026926509131519335</LONG>
				<ALT>0</ALT>
				<DESCPOINT>
					<SHOWDESC>0</SHOWDESC>
					<SHOWLABELBACKGROUND>1</SHOWLABELBACKGROUND>
					<SHOWDESCINREPORT>1</SHOWDESCINREPORT>
					<DESC/>
					<DESCLAT>39.98169269227767</DESCLAT>
					<DESCLONG>-0.026926509131519335</DESCLONG>
				</DESCPOINT>
			</POINT>
			<POINT>
				<LAT>39.98172567258662</LAT>
				<LONG>-0.026947912977230686</LONG>
				<ALT>0</ALT>
				<DESCPOINT>
					<SHOWDESC>0</SHOWDESC>
					<SHOWLABELBACKGROUND>1</SHOWLABELBACKGROUND>
					<SHOWDESCINREPORT>1</SHOWDESCINREPORT>
					<DESC/>
					<DESCLAT>39.98172567258662</DESCLAT>
					<DESCLONG>-0.026947912977230686</DESCLONG>
				</DESCPOINT>
			</POINT>
			<POINT>
				<LAT>39.98176129890663</LAT>
				<LONG>-0.026960117041006364</LONG>
				<ALT>0</ALT>
				<DESCPOINT>
					<SHOWDESC>0</SHOWDESC>